upc,match_name,sim_upc,sim_name
2567800716,,25678000060,"Ted Baker London Kcylie Printed Flocking Sweater in Light Pink at Nordstrom, Siz"
2567800716,,25678000084,GASKET DODGE
2567800716,,25678000091,"Kinco International 256789 Womens Kincopro Glove, Green - Medium"
2567800716,,25678180601,Estee LauderAdvanced Night Micro Cleansing Balm (Box Slightly Damaged) 70ml/2.2o
2567800716,,25678524702,Laura MercierCandleglow Sheer Perfecting Powder - # 3 (Box Slightly Damaged) 9g/
2567800716,,25678643373,CUSTOM VEHICLE COVER SATIN STRETCH YELLOW CLASS 3 FOR FERRAR
2567800716,,25678643427,"Mens Sweatpants, F_Gotal Men’s Pure Color Sweatpants Elastic Waist Sports Runnin"
2567800716,,25678775906,Commercial High Arch Stainless Steel Single Lever Swivel Sprayer And Pressure
2567800716,,25678976815,"Tcg: Hoenn Power Tin Card Game, Fast Free"
