upc,match_name,sim_upc,sim_name
3852111161,,38521000063,Marks And Spencer Blouse
3852111161,,38521000094,Hal Leonard Hope Of Deliverance Piano Vocal Series Performed by Paul McCartney
3852111161,,38521000599,"Vintage Teenage Mutant Ninja Turtles 4 Pack Pencils,  Mirage Studios,  New "
3852111161,,38521000759,Tmnt Miniatures Construction Paper Pad 90s Teenage Mutant Ninja Turtles
3852111161,,38521000766,(tas000093) - 1990 Mirage Studios Teenage Mutant Ninja Turtles Miniatures Mini T
3852111161,,38521000797,Tmnt Miniatures Mini Crayon Set Book 90s Teenage Mutant Ninja Turtles Miniatures
3852111161,,38521000803,Vintage 1990 Tmnt Teenage Mutant Ninja Turtles Miniatures Clip Board
3852111161,,38521000810,Nickelodeon Turtles Soft Pencil Toppers 10pc Set Battle Pack
3852111161,,38521001305,Vintage Tmnt Christmas Snowdome Ornament - Sweet
3852111161,,38521001367,Vintage Teenage Mutant Ninja Turtles Tmnt Pencil Topper Raphael In Package
