upc,match_name,sim_upc,sim_name
8637401047,,86374000068,Rocker Cover Gasket Fits Mazda Demio Dw 1.3 98 To 03 Adl B36610235 B36610235a
8637401047,,86374000792,"Sarris Candies Butter Mints Tin 9 oz, #0792"
8637401047,,86374001416,airblown inflatable halloween inflatable 7ft tall jack skellington nightmare bef
8637401047,,86374001799,"Sarris White Chocolate Covered Pretzels,Approx. 10 pcs. (8 oz.)"
8637401047,,86374008125,"Sarris Candies Chocolate Covered Popcorn 7 oz, # 8125"
8637401047,,86374008354,"Sarris Candies Sugar Free Chocolate Assortment, 15 pcs #0972"
8637401047,,86374015222,"Paramount Piano Blues, Volume 2: 1927-1932"
8637401047,,86374017554,"SARRIS CANDIES, PEANUT BUTTER FILLED NOVELTIES"
8637401047,,86374018650,"Sarris Sugar Free Dark Chocolate Pretzels, 8 oz (Approx. 8 pcs.)"
8637401047,,86374024279,Sarris Candies Milk Chocolate Mini Pretzels 7 oz.
