upc,match_name,sim_upc,sim_name
927582830042,,9275826437700,"Westclox 70043X Large Easy-to-Read LCD Battery Alarm Clock, Black (B005UQICMW)"
927582830042,,9275826468834,"Farberware Professional Silicone Mini Whisks (Red, Set of 2) (B00BY4E390)"
927582830042,,9275826473029,"Norpro Nonstick 3 Sided Splatter Guard Cover Bacon Grease Shield 9X10"" Panels (B"
927582830042,,9275826474019,Smartware Silicone Bakeware Blue Round Cake Pan (B01M4FFESA)
927582830042,,9275826474767,Thunder Group 3425 12356 Alsr001 Steel Wok Rack Medium Metallic
927582830042,,9275826476372,"Lodge ASAHH41 Silicone Assist Handle Holder, Red, 5.5"" x 2"" (B009YQP75E)"
927582830042,,9275826476839,"Regency Wraps Cotton Butchers Cooking Twine For Meat Trussing, Food Prep, Natura"
927582830042,,9275826477416,Genuine Fred STEAM SHIP Silicone Steaming Lid (B00I0VSC2E)
927582830042,,9275826479687,Vertical Poultry Roasting Pans Nonstick Roasted Chicken Rack Thanksgiving Dinner
927582830042,,9275826484261,Sterilite Stackable Ice Cube Trays (Pack of 3)
